{
  "schemaVersion": 1,
  "executorId": "calendar-fixture",
  "version": "1",
  "capability": {
    "schemaVersion": 1,
    "name": "calendar.block.create",
    "version": "1",
    "description": "Synthetic controlled calendar write",
    "risk": "CONTROLLED_WRITE",
    "inputSchemaId": "jarvis.calendar-block-input:1",
    "requiredScopes": [
      "calendar.events.write"
    ],
    "reversibility": "reversible",
    "authorityRequirement": "approval_or_finite_lease",
    "sensitivity": "private"
  },
  "idempotencyBehavior": "canonical_lock_and_reconcile",
  "expiryPolicy": {
    "maximumOperationAgeSeconds": 300,
    "checkBeforeDispatch": true
  },
  "credentialBoundary": {
    "resolverRef": "fixture-vault",
    "accountScopeRequired": true,
    "rawCredentialsToModel": false
  },
  "observationMethod": "calendar.read-result",
  "verificationMethod": "calendar.read-back",
  "reconciliationMethod": "calendar.lookup-operation",
  "killDomains": [
    "executor.dispatch"
  ],
  "timeoutSeconds": 30
}
